{
  "nodeName": "Root",
  "id": "Root",
  "levelName": "Root",
  "children": [
    {
      "nodeName": "Fresh Food",
      "id": "TO_1284175199",
      "levelName": "SuperDepartment",
      "children": [
        {
          "nodeName": "Fresh Fruit",
          "id": "TO_02038179352",
          "levelName": "Department",
          "children": [
            {
              "nodeName": "Apples, Pears & Rhubarb",
              "id": "TO_1794209734",
              "levelName": "Aisle",
              "children": [
                {
                  "nodeName": "Cooking Apples",
                  "id": "TO_0703061265",
                  "levelName": "Shelf"
                },
                {
                  "nodeName": "Red/Pink Eating Apples",
                  "id": "TO_1626390530",
                  "levelName": "Shelf"
                }
              ]
            }
          ]
        }
      ]
    }
  ]
}
